Symbol,Name,Last Sale,Net Change,% Change,Market Cap,Country,IPO Year,Volume,Sector,Industry,Exchange
HECCU,Hudson Executive Investment Corp. Units,$11.51,-0.68,-5.578%,0.00,United States,2020,88928,Finance,Business Services,nasdaq
HECCW,Hudson Executive Investment Corp. Warrant,$1.92,-0.30,-13.514%,0.00,United States,2020,1162568,Finance,Business Services,nasdaq
HEES,H&E Equipment Services Inc. Common Stock,$27.045,-2.245,-7.665%,976179917.00,United States,2006,309755,,,nasdaq
HELE,Helen of Troy Limited Common Stock,$262.89,14.71,5.927%,6413407656.00,Bermuda,,651134,Consumer Durables,Home Furnishings,nasdaq
HEPA,Hepion Pharmaceuticals Inc. Common Stock,$2.13,-0.09,-4.054%,68213576.00,United States,,1530858,Health Care,Major Pharmaceuticals,nasdaq
HFBL,Home Federal Bancorp Inc. of Louisiana Common StocK,$30.91,1.6715,5.717%,52035903.00,United States,,1156,Finance,Savings Institutions,nasdaq
HFEN,HF Enterprises Inc. Common Stock,$6.09,0.3237,5.614%,52191300.00,United States,2020,94104,Finance,Real Estate,nasdaq
HFFG,HF Foods Group Inc. Common Stock,$8.13,-0.06,-0.733%,422056031.00,United States,2017,321282,Consumer Non-Durables,Food Distributors,nasdaq
HFWA,Heritage Financial Corporation Common Stock,$23.98,-0.95,-3.811%,861128994.00,United States,,216566,Finance,Banks,nasdaq
HGBL,Heritage Global Inc. Common Stock,$2.89,-0.29,-9.119%,101708487.00,United States,,61732,Miscellaneous,Business Services,nasdaq
HGEN,Humanigen Inc. Common Stock,$18.85,0.07,0.373%,1036750000.00,United States,,1098879,Health Care,Major Pharmaceuticals,nasdaq
HGSH,China HGS Real Estate Inc. Common Stock,$1.87,-0.27,-12.617%,42121750.00,China,,414503,Finance,Real Estate,nasdaq
HHR,HeadHunter Group PLC American Depositary Shares,$29.59,-0.37,-1.235%,1488905477.00,Cyprus,2019,198651,Technology,Professional Services,nasdaq
HIBB,Hibbett Sports Inc. Common Stock,$54.86,0.86,1.593%,910551468.00,United States,1996,659962,Consumer Services,Other Specialty Stores,nasdaq
HIFS,Hingham Institution for Savings Common Stock,$225.51,-6.51,-2.806%,481892319.00,United States,,4906,,,nasdaq
HIHO,Highway Holdings Limited Common Stock,$4.59,-0.91,-16.545%,18230677.00,Hong Kong,,243757,Capital Goods,Metal Fabrications,nasdaq
HIMX,Himax Technologies Inc. American Depositary Shares,$9.90,0.14,1.434%,1704621907.00,Taiwan,2006,6011991,Technology,Semiconductors,nasdaq
HJLI,Hancock Jaffe Laboratories Inc. Common Stock,$9.50,-0.39,-3.943%,21224359.00,United States,2018,289980,Health Care,Medical/Dental Instruments,nasdaq
HJLIW,Hancock Jaffe Laboratories Inc. Warrants,$0.2412,-0.0004,-0.166%,0.00,United States,2018,40421,Health Care,Medical/Dental Instruments,nasdaq
HLAHU,Hamilton Lane Alliance Holdings I Inc. Unit,$10.45,-0.08,-0.76%,0.00,United States,2021,187676,Finance,Business Services,nasdaq
HLG,Hailiang Education Group Inc. American Depositary Shares,$61.00,-1.79,-2.851%,1572466601.00,China,2015,5026,Consumer Services,Other Consumer Services,nasdaq
HLIO,Helios Technologies Inc. Common Stock,$54.65,-2.35,-4.123%,1754913368.00,United States,,147527,Capital Goods,Metal Fabrications,nasdaq
HLIT,Harmonic Inc. Common Stock,$8.18,-0.04,-0.487%,799576710.00,United States,1995,548367,Technology,Radio And Television Broadcasting And Communications Equipment,nasdaq
HLNE,Hamilton Lane Incorporated Class A Common Stock,$75.42,-1.85,-2.394%,3978544753.00,United States,2017,203449,Finance,Investment Managers,nasdaq
HLXA,Helix Acquisition Corp. Class A Ordinary Shares,$10.95,-0.14,-1.262%,162114750.00,United States,2020,61620,Finance,Business Services,nasdaq
HMCOU,HumanCo Acquisition Corp. Unit,$11.35,-0.47,-3.976%,0.00,United States,2020,79013,Finance,Business Services,nasdaq
HMHC,Houghton Mifflin Harcourt Company Common Stock,$5.13,-0.13,-2.471%,645611085.00,United States,2013,1645513,Consumer Services,Books,nasdaq
HMNF,HMN Financial Inc. Common Stock,$18.20,0.225,1.252%,88021734.00,United States,,448,Finance,Savings Institutions,nasdaq
HMST,HomeStreet Inc. Common Stock,$35.87,-0.84,-2.288%,781533336.00,United States,2012,143809,Finance,Major Banks,nasdaq
HMSY,HMS Holdings Corp (DE),$36.57,-0.18,-0.49%,3239027683.00,United States,1992,1598560,Miscellaneous,Business Services,nasdaq
HMTV,Hemisphere Media Group Inc. Class A Common Stock,$9.57,-0.03,-0.313%,382432072.00,United States,,295664,Consumer Services,Television Services,nasdaq
HNNA,Hennessy Advisors Inc. Common Stock,$8.61,-0.36,-4.013%,63369126.00,United States,,34192,Finance,Investment Managers,nasdaq
HNRG,Hallador Energy Company Common Stock,$1.34,-0.10,-6.944%,40823991.00,United States,,446179,Energy,Coal Mining,nasdaq
HOFT,Hooker Furniture Corporation Common Stock,$31.68,-0.54,-1.676%,376588777.00,United States,,57047,Consumer Durables,Home Furnishings,nasdaq
HOFV,Hall of Fame Resort & Entertainment Company Common Stock,$2.44,-0.14,-5.426%,156382689.00,United States,,6340437,Consumer Services,Services-Misc. Amusement & Recreation,nasdaq
HOFVW,Hall of Fame Resort &amp; Entertainment Company Warrant,$0.6801,-0.0092,-1.335%,0.00,United States,,283706,Consumer Services,Services-Misc. Amusement & Recreation,nasdaq
HOL,Holicity Inc. Class A Common Stock,$10.30,0.145,1.428%,386250000.00,United States,2020,506988,Finance,Business Services,nasdaq
HOLI,Hollysys Automation Technologies Ltd. Common Shares (British Virgin Islands),$13.27,-0.96,-6.746%,803327304.00,China,,228992,Energy,Industrial Machinery/Components,nasdaq
HOLUU,Holicity Inc. Unit,$10.58,-0.32,-2.936%,0.00,United States,2020,29167,Finance,Business Services,nasdaq
HOLUW,Holicity Inc. Warrant,$1.78,-0.1199,-6.311%,0.00,United States,2020,45212,Finance,Business Services,nasdaq
HOLX,Hologic Inc. Common Stock,$72.51,-2.01,-2.697%,18683056538.00,United States,1990,3158768,Health Care,Medical Electronics,nasdaq
HOMB,Home BancShares Inc. Common Stock,$21.95,0.13,0.596%,3625427481.00,United States,2006,956387,Finance,Major Banks,nasdaq
HONE,HarborOne Bancorp Inc. Common Stock,$10.44,-0.43,-3.956%,609095324.00,United States,2016,248548,Finance,Major Banks,nasdaq
HOOK,HOOKIPA Pharma Inc. Common Stock,$11.17,-0.82,-6.839%,330414632.00,United States,2019,154771,Health Care,Major Pharmaceuticals,nasdaq
HOPE,Hope Bancorp Inc. Common Stock,$11.40,-0.72,-5.941%,1405180450.00,United States,,919399,Finance,Major Banks,nasdaq
HOTH,Hoth Therapeutics Inc. Common Stock,$2.23,-0.24,-9.717%,35489284.00,United States,2019,1186820,Health Care,Major Pharmaceuticals,nasdaq
HOVNP,Hovnanian Enterprises Inc Dep Shr Srs A Pfd,$10.94,0.14,1.296%,0.00,United States,,14527,Capital Goods,Homebuilding,nasdaq
HPK,HighPeak Energy Inc. Common Stock,$14.89,-1.56,-9.483%,1364740776.00,United States,,22434,Energy,Oil & Gas Production,nasdaq
HPKEW,HighPeak Energy Inc. Warrant,$3.24,-1.77,-35.329%,0.00,United States,,3216,Energy,Oil & Gas Production,nasdaq
HQI,HireQuest Inc. Common Stock (DE),$10.02,-0.14,-1.378%,136227742.00,United States,,37293,Technology,Professional Services,nasdaq
HQY,HealthEquity Inc. Common Stock,$90.23,-0.78,-0.857%,6946865989.00,United States,2014,1811932,Miscellaneous,Business Services,nasdaq
HRMY,Harmony Biosciences Holdings Inc. Common Stock,$35.52,-0.65,-1.797%,2020701223.00,United States,2020,146557,Health Care,Major Pharmaceuticals,nasdaq
HROW,Harrow Health Inc. Common Stock,$8.71,0.00,0.00%,224247373.00,United States,,470468,Health Care,Major Pharmaceuticals,nasdaq
HRTX,Heron Therapeutics Inc. Common Stock,$17.78,0.22,1.253%,1615406416.00,United States,,1645852,Health Care,Major Pharmaceuticals,nasdaq
HRZN,Horizon Technology Finance Corporation Common Stock,$13.62,-0.11,-0.801%,250166535.00,United States,2010,134150,,,nasdaq
HSAQ,Health Sciences Acquisitions Corporation 2 Ordinary Shares,$11.27,-1.06,-8.597%,230471500.00,United States,2020,104749,Finance,Business Services,nasdaq
HSDT,Helius Medical Technologies Inc. Class A Common Stock (DE),$14.82,-0.87,-5.545%,628161.00,United States,,525733,Health Care,Biotechnology: Electromedical & Electrotherapeutic Apparatus,nasdaq
HSIC,Henry Schein Inc. Common Stock,$68.17,-0.94,-1.36%,9733050691.00,United States,1995,1414814,Health Care,Medical Specialities,nasdaq
HSII,Heidrick & Struggles International Inc. Common Stock,$31.12,-0.25,-0.797%,602470316.00,United States,1999,143881,Technology,Diversified Commercial Services,nasdaq
HSKA,Heska Corporation Common Stock,$172.71,-1.95,-1.116%,1632933499.00,United States,1997,70577,Health Care,Biotechnology: In Vitro & In Vivo Diagnostic Substances,nasdaq
HSON,Hudson Global Inc. Common Stock,$14.54,0.59,4.229%,39039478.00,United States,,19096,Technology,Professional Services,nasdaq
HST,Host Hotels & Resorts Inc. Common Stock,$13.595,0.095,0.704%,9588967237.00,United States,,18309517,Consumer Services,Real Estate Investment Trusts,nasdaq
HSTM,HealthStream Inc. Common Stock,$24.43,-0.92,-3.629%,773892050.00,United States,2000,154928,Technology,Computer Software: Programming Data Processing,nasdaq
HSTO,Histogen Inc. Common Stock,$1.30,-0.17,-11.565%,34619984.00,United States,2013,3913196,Health Care,Major Pharmaceuticals,nasdaq
HTBI,HomeTrust Bancshares Inc. Common Stock,$19.93,-0.34,-1.677%,339223029.00,United States,2012,90996,Finance,Savings Institutions,nasdaq
HTBK,Heritage Commerce Corp Common Stock,$9.10,-0.435,-4.562%,545226382.00,United States,,204598,Finance,Major Banks,nasdaq
HTBX,Heat Biologics Inc. Common Stock,$7.36,-1.40,-15.982%,168059984.00,United States,2013,2706793,Health Care,Major Pharmaceuticals,nasdaq
HTGM,HTG Molecular Diagnostics Inc. Common Stock,$7.00,-0.22,-3.047%,33178145.00,United States,2015,173280,Capital Goods,Biotechnology: Laboratory Analytical Instruments,nasdaq
HTHT,Huazhu Group Limited American Depositary Shares,$47.84,1.52,3.282%,15333317713.00,China,2010,1331596,Consumer Services,Hotels/Resorts,nasdaq
HTIA,Healthcare Trust Inc. 7.375% Series A Cumulative Redeemable Perpetual Preferred Stock,$24.48,0.0529,0.217%,0.00,United States,,4276,Consumer Services,Real Estate Investment Trusts,nasdaq
HTLD,Heartland Express Inc. Common Stock,$19.26,-0.24,-1.231%,1553376780.00,United States,1986,1095071,Transportation,Trucking Freight/Courier Services,nasdaq
HTLF,Heartland Financial USA Inc. Common Stock,$42.34,-3.32,-7.271%,1782254117.00,United States,,207967,Finance,Major Banks,nasdaq
HTLFP,Heartland Financial USA Inc. Depositary Shares each representing a 1/400th ownership interest in a share of 7.00% Fixed-Rate Reset Non-Cumulative Perpetual Preferred Stock Series E,$27.33,-0.41,-1.478%,0.00,United States,,5614,Finance,Major Banks,nasdaq
HTOO,Fusion Fuel Green PLC Class A Ordinary Shares,$21.12,-0.68,-3.119%,245168458.00,Portugal,,648677,Public Utilities,Natural Gas Distribution,nasdaq
HTOOW,Fusion Fuel Green PLC Warrant,$9.08,-1.04,-10.277%,0.00,Portugal,,88459,Public Utilities,Natural Gas Distribution,nasdaq
HUBG,Hub Group Inc. Class A Common Stock,$55.74,-3.01,-5.123%,1903884536.00,United States,1996,173534,Transportation,Oil Refining/Marketing,nasdaq
HUDI,Huadi International Group Co. Ltd. Ordinary Shares,$6.31,-0.30,-4.539%,82818750.00,China,2021,102856,Basic Industries,Steel/Iron Ore,nasdaq
HUGE,FSD Pharma Inc. Class B Subordinate Voting Shares,$1.94,-0.27,-12.217%,37173682.00,Canada,,1446679,Health Care,Major Pharmaceuticals,nasdaq
HUIZ,Huize Holding Limited American Depositary Shares,$6.43,-0.11,-1.682%,334297513.00,China,2020,47056,Finance,Specialty Insurers,nasdaq
HURC,Hurco Companies Inc. Common Stock,$30.05,-0.75,-2.435%,197447582.00,United States,,44651,Capital Goods,Industrial Machinery/Components,nasdaq
HURN,Huron Consulting Group Inc. Common Stock,$56.30,-2.50,-4.252%,1287650981.00,United States,2004,126550,Consumer Services,Professional Services,nasdaq
HUSN,Hudson Capital Inc. Ordinary Shares,$3.57,-0.24,-6.299%,22869941.00,China,2017,1559735,Consumer Services,Professional Services,nasdaq
HVBC,HV Bancorp Inc. Common Stock,$16.56,-0.4201,-2.474%,36792097.00,United States,2017,1796,Finance,Major Banks,nasdaq
HWBK,Hawthorn Bancshares Inc. Common Stock,$19.00,-0.50,-2.564%,123122052.00,United States,,14576,Finance,Major Banks,nasdaq
HWC,Hancock Whitney Corporation Common Stock,$34.43,-2.00,-5.49%,2986045040.00,United States,,565230,Finance,Major Banks,nasdaq
HWCC,Houston Wire & Cable Company Common Stock,$3.25,-0.26,-7.407%,53769762.00,United States,2006,122952,Consumer Non-Durables,Telecommunications Equipment,nasdaq
HWCPL,Hancock Whitney Corporation 5.95% Subordinated Notes due 2045,$25.41,-0.09,-0.353%,0.00,United States,,6021,Finance,Major Banks,nasdaq
HWCPZ,Hancock Whitney Corporation 6.25% Subordinated Notes due 2060,$26.92,-0.13,-0.481%,0.00,United States,,11291,Finance,Major Banks,nasdaq
HWKN,Hawkins Inc. Common Stock,$50.05,-2.26,-4.32%,534065382.00,United States,,33171,Consumer Durables,Specialty Chemicals,nasdaq
HX,Xiaobai Maimai Inc. ADR,$2.33,-0.35,-13.06%,40742806.00,China,2017,132164,Finance,Finance: Consumer Services,nasdaq
HYFM,Hydrofarm Holdings Group Inc. Common Stock,$73.96,-2.09,-2.748%,2442212969.00,United States,2020,303324,Consumer Durables,Consumer Specialties,nasdaq
HYMC,Hycroft Mining Holding Corporation Class A Common Stock,$6.71,-0.07,-1.032%,336573882.00,United States,2018,86669,Basic Industries,Precious Metals,nasdaq
HYMCL,Hycroft Mining Holding Corporation Warrants,$1.6999,-0.1501,-8.114%,0.00,United States,,8049,Basic Industries,Precious Metals,nasdaq
HYMCW,Hycroft Mining Holding Corporation  Warrant,$1.25,0.03,2.459%,0.00,United States,2018,110726,Basic Industries,Precious Metals,nasdaq
HYMCZ,Hycroft Mining Holding Corporation Warrant,$0.5355,0.0255,5.00%,0.00,United States,,130216,Basic Industries,Precious Metals,nasdaq
HYRE,HyreCar Inc. Common Stock,$7.29,-0.92,-11.206%,129226921.00,United States,2018,306030,Consumer Services,Rental/Leasing Companies,nasdaq
HZNP,Horizon Therapeutics Public Limited Company Ordinary Shares,$71.83,-3.14,-4.188%,15853605477.00,Ireland,2011,2536707,Health Care,Major Pharmaceuticals,nasdaq
IAC,IAC/InterActiveCorp Common Stock,$209.01,-2.60,-1.229%,18552644736.00,United States,,1590697,Consumer Services,Other Consumer Services,nasdaq
IART,Integra LifeSciences Holdings Corporation Common Stock,$68.66,-1.20,-1.718%,5786161591.00,United States,,498319,Health Care,Medical/Dental Instruments,nasdaq
IBCP,Independent Bank Corporation Common Stock,$18.63,-0.91,-4.657%,407165003.00,United States,,160501,Finance,Major Banks,nasdaq
IBEX,IBEX Limited Common Shares,$19.23,-0.21,-1.08%,353604451.00,Bermuda,2020,27129,Technology,EDP Services,nasdaq
IBKR,Interactive Brokers Group Inc. Class A Common Stock,$63.13,-2.79,-4.232%,27047264994.00,United States,2019,1556618,Finance,Investment Bankers/Brokers/Service,nasdaq
IBOC,International Bancshares Corporation Common Stock,$38.61,-3.23,-7.72%,2443062267.00,United States,,319488,Finance,Major Banks,nasdaq
IBTX,Independent Bank Group Inc Common Stock,$62.19,-2.64,-4.072%,2682923180.00,United States,2013,225230,Finance,Major Banks,nasdaq
ICAD,iCAD Inc. Common Stock,$15.00,0.28,1.902%,344896530.00,United States,,297512,Health Care,Medical/Dental Instruments,nasdaq
ICBK,County Bancorp Inc. Common Stock,$20.84,-1.00,-4.579%,130672989.00,United States,2015,16867,Finance,Major Banks,nasdaq
ICCC,ImmuCell Corporation Common Stock,$7.45,-0.08,-1.062%,53736247.00,United States,1987,23545,Health Care,Biotechnology: In Vitro & In Vivo Diagnostic Substances,nasdaq
ICCH,ICC Holdings Inc. Common Stock,$14.25,0.00,0.00%,46929881.00,United States,2017,1,Finance,Property-Casualty Insurers,nasdaq
ICFI,ICF International Inc. Common Stock,$79.87,-1.32,-1.626%,1506593081.00,United States,2006,154670,Consumer Services,Professional Services,nasdaq
ICHR,Ichor Holdings Ordinary Shares,$35.09,-3.70,-9.539%,978467912.00,United States,2016,599135,Technology,Semiconductors,nasdaq
ICLK,iClick Interactive Asia Group Limited American Depositary Shares,$14.49,0.05,0.346%,1309488657.00,Hong Kong,2017,2471688,Technology,Computer Software: Prepackaged Software,nasdaq
ICLR,ICON plc Ordinary Shares,$207.89,-5.20,-2.44%,10971445267.00,Ireland,1998,386477,Health Care,Biotechnology: Commercial Physical & Biological Resarch,nasdaq
ICMB,Investcorp Credit Management BDC Inc. Common Stock,$4.65,-0.28,-5.68%,64667848.00,United States,2014,56458,,,nasdaq
ICON,Iconix Brand Group Inc. Common Stock,$1.67,0.04,2.454%,22001996.00,United States,,2271513,Consumer Non-Durables,Shoe Manufacturing,nasdaq
ICPT,Intercept Pharmaceuticals Inc. Common Stock,$37.75,3.97,11.753%,1245464459.00,United States,2012,2491493,Health Care,Major Pharmaceuticals,nasdaq
ICUI,ICU Medical Inc. Common Stock,$203.36,-12.39,-5.743%,4266722190.00,United States,1992,205672,Health Care,Medical/Dental Instruments,nasdaq
IDCC,InterDigital Inc. Common Stock,$66.97,-0.23,-0.342%,2063115457.00,United States,,280676,Miscellaneous,Multi-Sector Companies,nasdaq
IDEX,Ideanomics Inc. Common Stock,$4.11,0.25,6.477%,1527293258.00,United States,,84573127,Capital Goods,Auto Manufacturing,nasdaq
IDN,Intellicheck Inc. Common Stock,$11.22,-0.12,-1.058%,206557148.00,United States,1999,239284,Technology,Computer Software: Prepackaged Software,nasdaq
IDRA,Idera Pharmaceuticals Inc. Common Stock,$5.41,0.01,0.185%,205580000.00,United States,,527696,Health Care,Biotechnology: Biological Products (No Diagnostic Substances),nasdaq
IDXG,Interpace Biosciences Inc. Common Stock,$4.1705,-0.2595,-5.858%,16913851.00,United States,,129687,Health Care,Medical/Dental Instruments,nasdaq
IDXX,IDEXX Laboratories Inc. Common Stock,$465.18,-12.92,-2.702%,39679804226.00,United States,1991,583193,Health Care,Biotechnology: In Vitro & In Vivo Diagnostic Substances,nasdaq
IDYA,IDEAYA Biosciences Inc. Common Stock,$16.82,-0.79,-4.486%,541261023.00,United States,2019,111939,Health Care,Major Pharmaceuticals,nasdaq
IEA,Infrastructure and Energy Alternatives Inc. Common Stock,$20.21,-0.61,-2.93%,460570985.00,United States,2016,762830,Finance,Business Services,nasdaq
IEAWW,Infrastructure and Energy Alternatives Inc. Warrant,$4.38,-0.43,-8.94%,0.00,United States,2016,362505,Finance,Business Services,nasdaq
IEC,IEC Electronics Corp. Common Stock,$16.05,-1.79,-10.034%,170614951.00,United States,,406009,Technology,Electrical Products,nasdaq
IEP,Icahn Enterprises L.P. Common Stock,$55.79,-1.07,-1.882%,12947867221.00,United States,,150672,Capital Goods,Auto Parts:O.E.M.,nasdaq
IESC,IES Holdings Inc. Common Stock,$45.50,-1.32,-2.819%,945034272.00,United States,,62228,Capital Goods,Engineering & Construction,nasdaq
IFMK,iFresh Inc. Common Stock,$1.29,-0.14,-9.79%,46792734.00,United States,,4516005,Consumer Services,Food Chains,nasdaq
IFRX,InflaRx N.V. Common Stock,$5.61,-0.27,-4.592%,158361408.00,Germany,2017,325020,,,nasdaq
IGAC,IG Acquisition Corp. Class A Common Stock,$10.44,-0.14,-1.323%,403245000.00,United States,2020,533250,Finance,Business Services,nasdaq
IGACU,IG Acquisition Corp. Unit,$11.05,-0.42,-3.662%,0.00,United States,2020,95497,Finance,Business Services,nasdaq
IGACW,IG Acquisition Corp. Warrant,$1.50,-0.24,-13.793%,0.00,United States,2020,317982,Finance,Business Services,nasdaq
IGIC,International General Insurance Holdings Ltd. Ordinary Share,$8.00,0.37,4.849%,387200000.00,Jordan,2018,2143,Finance,Specialty Insurers,nasdaq
IGICW,International General Insurance Holdings Ltd. Warrants expiring 03/17/2025,$0.65,-0.08,-10.959%,0.00,Jordan,2018,3050,Finance,Specialty Insurers,nasdaq
IGMS,IGM Biosciences Inc. Common Stock,$96.13,-0.67,-0.692%,3068644076.00,United States,2019,343449,Health Care,Major Pharmaceuticals,nasdaq
IGNY,Ignyte Acquisition Corp.,,,,,United States,,0,,,nasdaq
IGNYU,Ignyte Acquisition Corp. Unit,,,,,United States,,0,,,nasdaq
IGNYW,Ignyte Acquisition Corp.,,,,,United States,,0,,,nasdaq
IHRT,iHeartMedia Inc. Class A Common Stock,$14.86,0.36,2.483%,1046388952.00,United States,,5461806,Consumer Services,Broadcasting,nasdaq
III,Information Services Group Inc. Information Services Group Inc. Common Stock,$3.62,0.03,0.836%,174051287.00,United States,,309761,Consumer Services,Professional Services,nasdaq
IIIIU,INSU Acquisition Corp. III Unit,$10.67,-0.23,-2.11%,0.00,United States,2020,58882,Finance,Business Services,nasdaq
IIIN,Insteel Industries Inc. Common Stock,$26.40,-0.62,-2.295%,509888729.00,United States,,101390,Capital Goods,Steel/Iron Ore,nasdaq
IIIV,i3 Verticals Inc. Class A Common Stock,$28.75,-0.35,-1.203%,888321583.00,United States,2018,250083,Miscellaneous,Business Services,nasdaq
IIN,Intricon Corporation Common Stock,$19.67,-0.95,-4.607%,175916088.00,United States,,40282,Capital Goods,Electrical Products,nasdaq
IIVI,II-VI Incorporated Common Stock,$87.23,-2.68,-2.981%,9048041834.00,United States,1987,1605691,Capital Goods,Electronic Components,nasdaq
IIVIP,II-VI Incorporated 6.00% Series A Mandatory Convertible Preferred Stock,$359.38,-15.78,-4.206%,0.00,United States,,15353,Capital Goods,Electronic Components,nasdaq
IKNX,Ikonics Corporation,$9.1601,-2.4299,-20.965%,18103600.00,United States,,84423,Miscellaneous,Industrial Machinery/Components,nasdaq
IKT,Inhibikase Therapeutics Inc. Common Stock,$6.42,-0.14,-2.134%,64809849.00,United States,2020,63567,Health Care,Biotechnology: Biological Products (No Diagnostic Substances),nasdaq
ILMN,Illumina Inc. Common Stock,$432.08,11.53,2.742%,63083680000.00,United States,2000,2227990,Capital Goods,Biotechnology: Laboratory Analytical Instruments,nasdaq
ILPT,Industrial Logistics Properties Trust Common Shares of Beneficial Interest,$21.84,-0.77,-3.406%,1426175762.00,United States,2018,350055,Consumer Services,Real Estate Investment Trusts,nasdaq
IMAB,I-MAB American Depositary Shares,$49.28,-0.97,-1.93%,3474028835.00,China,2020,161026,Health Care,Major Pharmaceuticals,nasdaq
IMAC,IMAC Holdings Inc. Common Stock,$1.66,-0.13,-7.263%,19654354.00,United States,2019,263156,Health Care,Medical Specialities,nasdaq
IMACW,IMAC Holdings Inc. Warrant,$0.4747,-0.0001,-0.021%,0.00,United States,2019,36,Health Care,Medical Specialities,nasdaq
IMBI,iMedia Brands Inc. Class A Common Stock,$5.82,0.07,1.217%,75757578.00,United States,,98523,Consumer Services,Catalog/Specialty Distribution,nasdaq
IMGN,ImmunoGen Inc. Common Stock,$7.30,-0.35,-4.575%,1421380847.00,United States,1989,2242687,Health Care,Major Pharmaceuticals,nasdaq
IMKTA,Ingles Markets Incorporated Class A Common Stock,$47.17,1.34,2.924%,955653634.00,United States,1987,160310,Consumer Services,Food Chains,nasdaq
IMMP,Immutep Limited American Depositary Shares,$3.06,-0.09,-2.857%,198265136.00,Australia,,1411584,Health Care,Major Pharmaceuticals,nasdaq
IMMR,Immersion Corporation Common Stock,$14.40,-0.49,-3.291%,387894312.00,United States,1999,1195432,Technology,Computer peripheral equipment,nasdaq
IMNM,Immunome Inc. Common Stock,$15.34,-0.71,-4.424%,161708589.00,United States,2020,91520,Health Care,Major Pharmaceuticals,nasdaq
IMOS,ChipMOS TECHNOLOGIES INC. American Depositary Shares,$24.9386,-0.1014,-0.405%,906817523.00,Taiwan,,8118,Technology,Semiconductors,nasdaq
IMRA,IMARA Inc. Common Stock,$13.20,-0.63,-4.555%,229778221.00,United States,2020,177025,Health Care,Major Pharmaceuticals,nasdaq
IMRN,Immuron Limited American Depositary Shares,$6.96,-0.58,-7.692%,38993400.00,Australia,2017,113533,Health Care,Major Pharmaceuticals,nasdaq
IMRNW,Immuron Limited Warrants,$1.60,0.10,6.667%,0.00,Australia,2017,12512,Health Care,Major Pharmaceuticals,nasdaq
IMTE,Integrated Media Technology Limited Ordinary Shares,$4.35,0.01,0.23%,28334469.00,Australia,,647277,Consumer Non-Durables,Consumer Electronics/Appliances,nasdaq
IMTX,Immatics N.V. Ordinary Shares,$10.34,-0.53,-4.876%,650475100.00,Germany,,525726,Health Care,Biotechnology: Biological Products (No Diagnostic Substances),nasdaq
IMTXW,Immatics N.V. Warrants,$2.64,-0.04,-1.493%,0.00,Germany,,13891,Health Care,Biotechnology: Biological Products (No Diagnostic Substances),nasdaq
IMUX,Immunic Inc. Common Stock,$16.10,-1.18,-6.829%,333565274.00,United States,2014,186370,Health Care,Major Pharmaceuticals,nasdaq
IMV,IMV Inc. Common Shares,$3.63,0.09,2.542%,243549576.00,Canada,,449571,Health Care,Major Pharmaceuticals,nasdaq
IMVT,Immunovant Inc. Common Stock,$38.06,-1.58,-3.986%,3113754330.00,United States,2019,850777,Health Care,Biotechnology: Biological Products (No Diagnostic Substances),nasdaq
IMXI,International Money Express Inc. Common Stock,$14.40,-0.54,-3.614%,548249501.00,United States,2017,162245,Miscellaneous,Business Services,nasdaq
INAQ,INSU Acquisition Corp. II Class A Common Stock,$14.60,-1.67,-10.264%,466129338.00,United States,2020,1715912,Finance,Property-Casualty Insurers,nasdaq
INAQU,INSU Acquisition Corp. II Unit,$15.29,-2.60,-14.533%,0.00,United States,2020,6999,Finance,Property-Casualty Insurers,nasdaq
INAQW,INSU Acquisition Corp. II Warrant,$3.21,-0.59,-15.526%,0.00,United States,2020,128700,Finance,Property-Casualty Insurers,nasdaq
INBK,First Internet Bancorp Common Stock,$30.94,-0.67,-2.12%,303229605.00,United States,,44871,Finance,Major Banks,nasdaq
INBKL,First Internet Bancorp 6.0% Fixed-to-Floating Rate Subordinated Notes due 2026,$25.30,-0.27,-1.056%,0.00,United States,,500,Finance,Major Banks,nasdaq
INBKZ,First Internet Bancorp 6.0% Fixed-to-Floating Rate Subordinated Notes Due 2029,$25.75,-0.01,-0.039%,0.00,United States,,2345,Finance,Major Banks,nasdaq
INBX,Inhibrx Inc. Common Stock,$30.35,-3.71,-10.893%,1144571037.00,United States,2020,80348,Health Care,Biotechnology: Biological Products (No Diagnostic Substances),nasdaq
INCY,Incyte Corp. Common Stock,$93.00,-6.39,-6.429%,20366636370.00,United States,,1260721,Health Care,Biotechnology: Commercial Physical & Biological Resarch,nasdaq
INDB,Independent Bank Corp. Common Stock,$76.52,-2.09,-2.659%,2522534752.00,United States,,121753,Finance,Major Banks,nasdaq
INDT,INDUS Realty Trust Inc. (MD) Common Stock,$63.28,-1.96,-3.004%,357994071.00,United States,,7297,Finance,Real Estate,nasdaq
INFI,Infinity Pharmaceuticals Inc. Common Stock,$3.37,-0.44,-11.549%,216376774.00,United States,,2183130,Health Care,Major Pharmaceuticals,nasdaq
