Symbol,Name,Last Sale,Net Change,% Change,Market Cap,Country,IPO Year,Volume,Sector,Industry,Exchange
FTK,Flotek Industries Inc. Common Stock,$1.83,-0.17,-8.50%,133763669.00,United States,,1388211,Basic Industries,Major Chemicals,nyse
FTS,Fortis Inc. Common Shares,$40.30,-1.04,-2.516%,18810846798.00,,2016,551543,Public Utilities,Electric Utilities: Central,nyse
FTV,Fortive Corporation Common Stock ,$66.14,-0.86,-1.284%,22302131138.00,,2016,3495240,Capital Goods,Industrial Machinery/Components,nyse
FTV.PRA,Fortive Corporation,,,,,,,0,,,nyse
FUBO,fuboTV Inc. Common Stock,$46.75,2.83,6.444%,3158562022.00,,2020,57879775,Consumer Services,Movies/Entertainment,nyse
FUL,H. B. Fuller Company Common Stock,$51.89,-0.30,-0.575%,2684558208.00,United States,,736980,Basic Industries,Home Furnishings,nyse
FUN,Cedar Fair L.P. Common Stock,$38.52,-2.17,-5.333%,2184328140.00,United States,1987,724044,Consumer Services,Services-Misc. Amusement & Recreation,nyse
FUSE,Fusion Acquisition Corp. Class A Common Stock,$11.15,-0.61,-5.187%,487812500.00,United States,2020,2555633,Finance,Business Services,nyse
FUSE.U,Fusion Acquisition Corp. Units each consisting of one share of Class A Common Stock and one-half of one redeemable Warrant,,,,,United States,2020,0,,,nyse
FUSE.WS,Fusion Acquisition Corp. Warrants each whole warrant exercisable for one share of Class A common stock at an exercise price of $11.50 per share,,,,,United States,,0,,,nyse
FVRR,Fiverr International Ltd. Ordinary Shares no par value,$208.76,-5.85,-2.726%,7331074396.00,,2019,1436793,Miscellaneous,Business Services,nyse
FVT.U,Fortress Value Acquisition Corp. III Units each consisting of one share of Class A common stock and one-fifth of one Warrant,,,,,,2021,0,,,nyse
G,Genpact Limited Common Stock,$38.45,-2.24,-5.505%,7280418450.00,Bermuda,2007,871357,Consumer Services,Professional Services,nyse
GAB,Gabelli Equity Trust Inc. (The) Common Stock,$6.14,-0.09,-1.445%,1594556551.00,United States,1986,687038,,,nyse
GAB.PRG,Gabelli Equity Trust Inc. (The),,,,,,,0,,,nyse
GAB.PRH,Gabelli Equity Trust Inc. (The),,,,,,,0,,,nyse
GAB.PRJ,Gabelli Equity Trust Inc. (The),,,,,,,0,,,nyse
GAB.PRK,Gabelli Equity Trust Inc. (The),,,,,,,0,,,nyse
GAM,General American Investors Inc. Common Stock,$37.38,-0.76,-1.993%,921195038.00,United States,,33178,,,nyse
GAM.PRB,General American Investors Inc.,,,,,,,0,,,nyse
GATO,Gatos Silver Inc. Common Stock,$11.16,-1.29,-10.361%,660483128.00,United States,2020,427616,Basic Industries,Precious Metals,nyse
GATX,GATX Corporation Common Stock,$91.40,2.50,2.812%,3199000000.00,United States,,521338,Consumer Services,Transportation Services,nyse
GB,Global Blue Group Holding AG Ordinary Shares,$13.75,0.15,1.103%,2389121254.00,,2000,107541,Technology,EDP Services,nyse
GB.WS,Global Blue Group Holding AG Warrants exercisable for one Ordinary Share of Global Blue Group Holding AG at a price of $11.50 per share,,,,,,,0,,,nyse
GBAB,Guggenheim Taxable Municipal Bond & Investment Grade Debt Trust Common Shares of Beneficial Interest,$25.07,0.25,1.007%,487669788.00,United States,2010,50581,,,nyse
GBL,Gamco Investors Inc. Common Stock,$17.70,-0.41,-2.264%,486799755.00,United States,1999,27199,Finance,Investment Bankers/Brokers/Service,nyse
GBX,Greenbrier Companies Inc. (The) Common Stock,$37.06,0.75,2.066%,1216460405.00,United States,1994,564261,Capital Goods,Railroads,nyse
GCI,Gannett Co. Inc. Common Stock,$4.61,0.41,9.762%,635302602.00,,2014,4721542,Consumer Services,Newspapers/Magazines,nyse
GCO,Genesco Inc. Common Stock,$38.36,-0.47,-1.21%,575096112.00,United States,,316999,Consumer Services,Clothing/Shoe/Accessory Stores,nyse
GCP,GCP Applied Technologies Inc. Common Stock,$24.97,-1.34,-5.093%,1824265726.00,,2016,269169,Basic Industries,Major Chemicals,nyse
GCV,Gabelli Convertible and Income Securities Fund Inc. (The) Common Stock,$6.27,-0.18,-2.791%,118010084.00,United States,,48577,,,nyse
GD,General Dynamics Corporation Common Stock,$152.73,2.40,1.596%,43829256470.00,United States,,2373493,Capital Goods,Marine Transportation,nyse
GDDY,GoDaddy Inc. Class A Common Stock,$77.89,-4.20,-5.116%,13155395664.00,United States,2015,1433283,Technology,EDP Services,nyse
GDL,GDL Fund The Common Shares of Beneficial Interest,$8.70,-0.05,-0.571%,122962390.00,United States,2007,12338,,,nyse
GDL.PRC,The GDL Fund,,,,,,,0,,,nyse
GDO,Western Asset Global Corporate Defined Opportunity Fund Inc. Western Asset Global Corporate Defined Opportunity Fund Inc.,$17.81,0.01,0.056%,266053367.00,United States,2009,42046,,,nyse
GDOT,Green Dot Corporation Class A Common Stock $0.001 par value,$51.77,0.61,1.192%,2768648469.00,United States,2010,1010415,Finance,Finance: Consumer Services,nyse
GDV,Gabelli Dividend & Income Trust Common Shares of Beneficial Interest,$21.57,-0.71,-3.187%,1952704081.00,United States,2003,262622,,,nyse
GDV.PRG,The Gabelli Dividend & Income Trust,,,,,,,0,,,nyse
GDV.PRH,The Gabelli Dividend & Income Trust,,,,,,,0,,,nyse
GE,General Electric Company Common Stock,$11.38,0.09,0.797%,99687354740.00,United States,,148739358,Energy,Consumer Electronics/Appliances,nyse
GEF,Greif Inc. Class A Common Stock,$46.25,-2.03,-4.205%,2749866501.00,United States,,224636,,,nyse
GEF.B,Greif Inc. Corporation Class B Common Stock,,,,,United States,,0,,,nyse
GEL,Genesis Energy L.P. Common Units,$5.82,-0.12,-2.02%,713411049.00,United States,1996,1609122,Energy,Natural Gas Distribution,nyse
GEN,Genesis Healthcare Inc. Common Stock,$0.65,-0.0393,-5.701%,108417889.00,United States,,2888894,Health Care,Hospital/Nursing Management,nyse
GEO,Geo Group Inc (The) REIT,$8.62,1.21,16.329%,1045738946.00,United States,,13804936,Consumer Services,Real Estate Investment Trusts,nyse
GER,Goldman Sachs MLP Energy Renaissance Fund,$8.18,-0.255,-3.023%,72458849.00,,1986,100637,,,nyse
GES,Guess? Inc. Common Stock,$22.89,-0.82,-3.458%,1456373480.00,United States,1996,1355848,Consumer Non-Durables,Apparel,nyse
GF,New Germany Fund Inc. (The) Common Stock,$19.48,-0.57,-2.843%,306401465.00,United States,1990,16179,,,nyse
GFF,Griffon Corporation Common Stock,$21.82,-1.17,-5.089%,1226838795.00,United States,,605828,Capital Goods,Building Products,nyse
GFI,Gold Fields Limited American Depositary Shares,$9.45,-0.32,-3.275%,8347501745.00,South Africa,,7930465,Basic Industries,Precious Metals,nyse
GFL,GFL Environmental Inc. Subordinate voting shares no par value,$28.70,-0.76,-2.58%,9366656242.00,,2020,1258530,Public Utilities,Environmental Services,nyse
GFLU,GFL Environmental Inc. Tangible Equity Units,$68.84,-2.09,-2.947%,0.00,,2020,178260,Public Utilities,Environmental Services,nyse
GFX.U,Golden Falcon Acquisition Corp. Units each consisting of one share of Class A Common Stock and one-half of one Warrant,,,,,,2020,0,,,nyse
GGB,Gerdau S.A. Common Stock,$4.32,-0.17,-3.786%,7349017386.00,Brazil,,6816123,Capital Goods,Steel/Iron Ore,nyse
GGG,Graco Inc. Common Stock,$68.59,-2.50,-3.517%,11491643843.00,United States,,1059152,Capital Goods,Fluid Controls,nyse
GGM,Guggenheim Credit Allocation Fund Common Shares of Beneficial Interest,$20.22,-0.11,-0.541%,183189257.00,,2013,58427,,,nyse
GGT,Gabelli Multi-Media Trust Inc. (The) Common Stock,$8.26,-0.14,-1.667%,207363071.00,United States,,101585,,,nyse
GGT.PRE,Gabelli Multi-Media Trust Inc. (The),,,,,,,0,,,nyse
GGT.PRG,Gabelli Multi-Media Trust Inc. (The),,,,,,,0,,,nyse
GGZ,Gabelli Global Small and Mid Cap Value Trust (The) Common Shares of Beneficial Interest,$12.94,-0.20,-1.522%,119936396.00,,2014,27066,,,nyse
GGZ.PRA,Gabelli Global Small and Mid Cap Value Trust (The),,,,,,,0,,,nyse
GHC,Graham Holdings Company Common Stock,$569.81,-3.08,-0.538%,2852738380.00,United States,,18787,Consumer Services,Other Consumer Services,nyse
GHG,GreenTree Hospitality Group Ltd. American depositary shares each representing one Class A ordinary share,$13.01,0.01,0.077%,1329348205.00,,2018,22145,Consumer Services,Hotels/Resorts,nyse
GHL,Greenhill & Co. Inc. Common Stock,$11.35,-0.54,-4.542%,215333993.00,United States,2004,953233,Finance,Investment Bankers/Brokers/Service,nyse
GHLD,Guild Holdings Company Class A Common Stock,$15.58,-0.14,-0.891%,934800000.00,,2020,78780,Finance,Finance: Consumer Services,nyse
GHM,Graham Corporation Common Stock,$15.58,-0.42,-2.625%,155439993.00,United States,,37539,Technology,Industrial Machinery/Components,nyse
GHY,PGIM Global High Yield Fund Inc.,$14.50,-0.03,-0.206%,593396246.00,United States,2012,150316,,,nyse
GIB,CGI Inc. Common Stock,$77.37,-0.25,-0.322%,19887969719.00,Canada,,202564,Consumer Services,Professional Services,nyse
GIK,GigCapital3 Inc. Common Stock,$14.72,-0.95,-6.063%,381152011.00,,2020,2898424,Capital Goods,Auto Manufacturing,nyse
GIK.U,GigCapital3 Inc. Units each consisting of one share of Common Stock and three-fourths of one Redeemable Warrant to purchase one share of Common Stock,,,,,,2020,0,,,nyse
GIK.WS,GigCapital3 Inc. Redeemable Warrants each exercisable for one share of Common Stock at an exercise price of $11.50 per share,,,,,,,0,,,nyse
GIL,Gildan Activewear Inc. Class A Sub. Vot. Common Stock,$25.41,-0.60,-2.307%,5038988696.00,Canada,1998,640714,Consumer Non-Durables,Apparel,nyse
GIM,Templeton Global Income Fund Inc. Common Stock,$5.63,0.04,0.716%,755231610.00,United States,1988,878756,,,nyse
GIS,General Mills Inc. Common Stock,$60.40,1.27,2.148%,36930770519.00,United States,,7344937,Consumer Non-Durables,Packaged Foods,nyse
GIX,GigCapital2 Inc. Common Stock,$10.40,-0.22,-2.072%,231348000.00,,2019,1417194,Finance,Business Services,nyse
GIX.RT,GigCapital2 Inc.,,,,,,,0,,,nyse
GIX.U,GigCapital2 Inc. Units each consisting of one share of Common Stock and one Warrant,,,,,,2019,0,,,nyse
GIX.WS,GigCapital2 Inc. Warrants exercisable for one share of Common Stock at an exercise price of $11.50 per share,,,,,,,0,,,nyse
GJH,Synthetic Fixed-Income Securities Inc 6.375% (STRATS) Cl A-1,$10.38,0.00,0.00%,0.00,United States,,72,Finance,Finance: Consumer Services,nyse
GJO,Synthetic Fixed-Income Securities Inc. Synthetic Fixed-Income Securities Inc. on behalf of STRATS(SM) Trust for Wal-Mart Stores Inc. Securities Series 2004-5,$23.46,-0.34,-1.429%,0.00,United States,,3000,Finance,Finance: Consumer Services,nyse
GJP,Synthetic Fixed-Income Securities Inc. Synthetic Fixed-Income Securities Inc. on behalf of STRATS (SM) Trust for Dominion Resources Inc. Securities Series 2005-6 Floating Rate Structured Repackaged Asset-Backed Trust Securities (STRATS) Certificates,$24.90,0.00,0.00%,0.00,United States,,100,,,nyse
GJR,Synthetic Fixed-Income Securities Inc. STRATS Trust for Procter&Gamble Securities Series 2006-1,$23.00,0.00,0.00%,0.00,United States,,0,,,nyse
GJS,Goldman Sachs Group Securities STRATS Trust for Goldman Sachs Group Securities Series 2006-2,$21.00,0.00,0.00%,0.00,United States,,20,Finance,Finance: Consumer Services,nyse
GJT,Synthetic Fixed-Income Securities Inc. Synthetic Fixed-Income Securities Inc. Floating Rate Structured Repackaged Asset-Backed Trust Securities Certificates Series 2006-3,$20.61,0.12,0.586%,0.00,United States,,1850,Finance,Finance: Consumer Services,nyse
GKOS,Glaukos Corporation Common Stock,$88.37,2.80,3.272%,3973240420.00,United States,2015,781124,Health Care,Medical/Dental Instruments,nyse
GL,Globe Life Inc. Common Stock,$90.20,-2.91,-3.125%,9440512310.00,United States,,489359,Finance,Life Insurance,nyse
GL.PRC,Globe Life Inc.,,,,,,,0,,,nyse
GLEO,Galileo Acquisition Corp. Ordinary Shares,$10.20,-0.20,-1.923%,177480000.00,,2019,85624,Finance,Business Services,nyse
GLEO.U,Galileo Acquisition Corp. Units each consisting of one Ordinary Share and one Redeemable Warrant,,,,,,2019,0,,,nyse
GLEO.WS,Galileo Acquisition Corp. Redeemable Warrants each whole warrant exercisable for one Ordinary Share at an exercise price of $11.50,,,,,,,0,,,nyse
GLOB,Globant S.A. Common Shares,$194.70,-5.52,-2.757%,7702309999.00,,2014,189437,Technology,EDP Services,nyse
GLOG,GasLog Ltd. Common Shares,$3.78,-0.40,-9.569%,360586016.00,Monaco,2012,4562507,Consumer Services,Marine Transportation,nyse
GLOG.PRA,GasLog LP.,,,,,,,0,,,nyse
GLOP,GasLog Partners LP Common Units representing limited partnership interests,$3.28,-0.02,-0.606%,166014445.00,,2014,451225,Consumer Services,Marine Transportation,nyse
GLOP.PRA,GasLog Partners LP,,,,,,,0,,,nyse
GLOP.PRB,GasLog Partners LP,,,,,,,0,,,nyse
GLOP.PRC,GasLog Partners LP,,,,,,,0,,,nyse
GLP,Global Partners LP Global Partners LP Common Units representing Limited Partner Interests,$19.84,0.14,0.711%,674471970.00,United States,2005,143174,Energy,Oil Refining/Marketing,nyse
GLP.PRA,Global Partners LP,,,,,,,0,,,nyse
GLT,Glatfelter Corporation Common Stock,$16.32,-1.38,-7.797%,724083084.00,United States,,199768,Basic Industries,Paper,nyse
GLW,Corning Incorporated Common Stock,$35.23,-1.94,-5.219%,26916073322.00,United States,,9004071,Basic Industries,Telecommunications Equipment,nyse
GM,General Motors Company Common Stock,$49.34,-2.70,-5.188%,70620716984.00,United States,2010,38233865,Capital Goods,Auto Manufacturing,nyse
GME,GameStop Corporation Common Stock,$347.51,199.53,134.836%,24237766070.00,United States,2002,91711003,Consumer Services,Electronics Distribution,nyse
GMED,Globus Medical Inc. Class A Common Stock,$61.39,-1.99,-3.14%,6057722218.00,United States,2012,456553,Health Care,Medical/Dental Instruments,nyse
GMRE,Global Medical REIT Inc. Common Stock,$12.57,-0.48,-3.678%,605727270.00,,2016,622113,Consumer Services,Real Estate Investment Trusts,nyse
GMRE.PRA,Global Medical REIT Inc.,,,,,,,0,,,nyse
GMS,GMS Inc. Common Stock,$28.33,-2.40,-7.81%,1209154656.00,United States,2016,611699,Consumer Services,RETAIL: Building Materials,nyse
GMTA,GATX Corporation 5.625% Senior Notes due 2066,$25.65,-0.06,-0.233%,0.00,United States,2016,18169,Consumer Services,Transportation Services,nyse
GNE,Genie Energy Ltd. Class B Common Stock Stock,$7.46,-0.02,-0.267%,195598962.00,United States,2011,88430,Public Utilities,Power Generation,nyse
GNE.PRA,Genie Energy Ltd.,,,,,,,0,,,nyse
GNK,Genco Shipping & Trading Limited Ordinary Shares New (Marshall Islands),$7.52,-0.53,-6.584%,314349183.00,United States,,877727,Transportation,Marine Transportation,nyse
GNL,Global Net Lease Inc. Common Stock,$16.44,-0.46,-2.722%,1471093385.00,United States,2015,533053,Consumer Services,Real Estate Investment Trusts,nyse
GNL.PRA,Global Net Lease Inc.,,,,,,,0,,,nyse
GNL.PRB,Global Net Lease Inc.,,,,,,,0,,,nyse
GNPK,Genesis Park Acquisition Corp. Class A Ordinary Shares,$10.37,-0.08,-0.766%,0.00,United States,2021,362799,Finance,Business Services,nyse
GNPK.U,Genesis Park Acquisition Corp. Units each consisting of one Class A ordinary share and one-half of one redeemable warrant,,,,,United States,2020,0,,,nyse
GNPK.WS,Genesis Park Acquisition Corp. Redeemable Warrants each whole warrant exercisable for one Class A ordinary share at an exercise price of $11.50 per share,,,,,United States,,0,,,nyse
GNRC,Generac Holdlings Inc. Common Stock,$248.81,-16.00,-6.042%,15635495833.00,United States,2010,938524,Consumer Durables,Metal Fabrications,nyse
GNT,GAMCO Natural Resources Gold & Income Trust,$4.98,-0.08,-1.581%,99164300.00,United States,2011,78624,,,nyse
GNT.PRA,GAMCO Natural Resources Gold & Income Tust ,,,,,,,0,,,nyse
GNW,Genworth Financial Inc Common Stock,$2.92,-0.23,-7.302%,1476336798.00,United States,2004,14749641,Finance,Life Insurance,nyse
GOAC,GO Acquisition Corp. Class A Common Stock,$10.30,-0.05,-0.483%,740312500.00,,2020,695210,Finance,Business Services,nyse
GOAC.U,GO Acquisition Corp. Units each consisting of one share of Class A Common Stock and one-third of one Warrant,,,,,,2020,0,,,nyse
GOAC.WS,GO Acquisition Corp. Warrants each whole warrant exercisable for one share of Class A Common Stock at an exercise price of $11.50,,,,,,,0,,,nyse
GOF,Guggenheim Strategic Opportunities Fund Common Shares of Beneficial Interest,$20.30,-0.14,-0.685%,897781527.00,United States,,341424,,,nyse
GOL,Gol Linhas Aereas Inteligentes S.A. Sponsored ADR representing 2 Pfd Shares,$8.47,0.21,2.542%,1499233654.00,Brazil,2004,1360153,Transportation,Air Freight/Delivery Services,nyse
GOLD,Barrick Gold Corporation Common Stock (BC),$21.99,-1.29,-5.541%,39100987398.00,Canada,,32556799,Basic Industries,Precious Metals,nyse
GOLF,Acushnet Holdings Corp. Common Stock,$41.84,0.17,0.408%,3108482173.00,United States,2016,306471,Consumer Non-Durables,Recreational Products/Toys,nyse
GOOS,Canada Goose Holdings Inc. Subordinate Voting Shares,$35.72,1.70,4.997%,3934439195.00,,2017,3465583,Consumer Non-Durables,Apparel,nyse
GPC,Genuine Parts Company Common Stock,$98.80,-2.70,-2.66%,14255817716.00,United States,,1228558,Capital Goods,Automotive Aftermarket,nyse
GPI,Group 1 Automotive Inc. Common Stock,$141.50,-10.54,-6.932%,2591460291.00,United States,1997,401386,Consumer Durables,Automotive Aftermarket,nyse
GPJA,Georgia Power Company Series 2017A 5.00% Junior Subordinated Notes due October 1 2077,$27.47,-0.16,-0.579%,0.00,United States,2017,15869,Public Utilities,Electric Utilities: Central,nyse
GPK,Graphic Packaging Holding Company,$16.10,-0.55,-3.303%,4359608715.00,United States,,4844999,Consumer Durables,Containers/Packaging,nyse
GPM,Guggenheim Enhanced Equity Income Fund,$6.45,-0.16,-2.421%,311809686.00,,,146428,,,nyse
GPMT,Granite Point Mortgage Trust Inc. Common Stock,$9.57,-0.35,-3.528%,528312635.00,,2017,747355,Consumer Services,Real Estate Investment Trusts,nyse
GPN,Global Payments Inc. Common Stock,$177.58,-8.76,-4.701%,53156311696.00,United States,,3043622,Miscellaneous,Business Services,nyse
GPRK,Geopark Ltd Common Shares,$12.75,-0.01,-0.078%,772806290.00,Bermuda,2014,119671,Energy,Oil & Gas Production,nyse
GPS,Gap Inc. (The) Common Stock,$19.54,-2.28,-10.449%,7300008607.00,United States,,17058748,Consumer Services,Clothing/Shoe/Accessory Stores,nyse
GPX,GP Strategies Corporation Common Stock,$12.08,-0.35,-2.816%,207315438.00,United States,,40801,Consumer Services,Other Consumer Services,nyse
GRA,W.R. Grace & Co. Common Stock,$58.01,-1.17,-1.977%,3839698143.00,United States,,515779,Basic Industries,Major Chemicals,nyse
GRC,Gorman-Rupp Company (The) Common Stock,$30.50,-1.53,-4.777%,796110756.00,United States,,92352,Capital Goods,Fluid Controls,nyse
GRP.U,Granite Real Estate Inc. Stapled Units each consisting of one unit of Granite Real Estate Trust and one common share of Granite REIT Inc.,,,,,Canada,,0,,,nyse
GRUB,GrubHub Inc. Common Stock,$72.07,-3.08,-4.098%,6684850832.00,,2014,1058037,Miscellaneous,Business Services,nyse
GRX,The Gabelli Healthcare & Wellness Trust Common Shares of Beneficial Interest,$12.10,-0.31,-2.498%,216365412.00,United States,,54688,,,nyse
GS,Goldman Sachs Group Inc. (The) Common Stock,$273.33,-8.43,-2.992%,94044048767.00,United States,1999,3880041,Finance,Investment Bankers/Brokers/Service,nyse
GS.PRA,Goldman Sachs Group Inc. (The),,,,,,,0,,,nyse
GS.PRC,Goldman Sachs Group Inc. (The),,,,,,,0,,,nyse
GS.PRD,Goldman Sachs Group Inc. (The),,,,,,,0,,,nyse
GS.PRJ,Goldman Sachs Group Inc. (The),,,,,,,0,,,nyse
GS.PRK,Goldman Sachs Group Inc. (The),,,,,,,0,,,nyse
GS.PRN,Goldman Sachs Group Inc. (The),,,,,,,0,,,nyse
GSAH,GS Acquisition Holdings Corp II Class A Common Stock,$11.26,-0.93,-7.629%,1055625000.00,United States,2020,6100334,Finance,Business Services,nyse
GSAH.U,GS Acquisition Holdings Corp II Units each consisting of one share of Class A Common Stock and one-quarter of one redeemable Warrant,,,,,United States,2020,0,,,nyse
GSAH.WS,GS Acquisition Holdings Corp II Redeemable Warrants each whole warrant exercisable for one share of Class A common stock at an exercise price of $11.50,,,,,United States,,0,,,nyse
GSBD,Goldman Sachs BDC Inc. Common Stock,$17.97,-0.09,-0.498%,1824572629.00,United States,2015,298565,,,nyse
GSK,GlaxoSmithKline PLC Common Stock,$38.18,-1.06,-2.701%,96022388184.00,United Kingdom,,4901292,Health Care,Major Pharmaceuticals,nyse
GSL,Global Ship Lease Inc New Class A Common Shares,$11.95,-0.31,-2.529%,217980046.00,United Kingdom,,954860,Transportation,Marine Transportation,nyse
GSL.PRB,Global Ship Lease Inc.,,,,,,,0,,,nyse
GSLD,Global Ship Lease Inc. 8.00% Senior Notes due 2024,$25.60,-0.06,-0.234%,0.00,United Kingdom,2019,8571,Transportation,Marine Transportation,nyse
GSX,GSX Techedu Inc. American Depositary Shares three of which representing two Class A Ordinary Shares,$142.70,37.76,35.982%,34025393280.00,,2019,32777370,Consumer Services,Other Consumer Services,nyse
GTES,Gates Industrial Corporation plc Ordinary Shares,$15.15,-0.71,-4.477%,4405468515.00,,2018,318147,Technology,Industrial Machinery/Components,nyse
GTN,Gray Television Inc. Common Stock,$17.55,-0.29,-1.626%,1687625041.00,United States,,845641,Consumer Services,Broadcasting,nyse
GTN.A,Gray Television Inc. CLass A Common Stock,,,,,,,0,,,nyse
GTS,Triple-S Management Corporation Class B Common Stock,$23.56,-0.68,-2.805%,552016030.00,United States,2007,119526,Finance,Accident &Health Insurance,nyse
GTT,GTT Communications Inc. Common Stock,$5.65,1.02,22.03%,332330390.00,United States,,4517099,Public Utilities,Telecommunications Equipment,nyse
GTY,Getty Realty Corporation Common Stock,$26.82,-0.85,-3.072%,1148065771.00,United States,,325140,Finance,Real Estate,nyse
GUT,Gabelli Utility Trust (The) Common Stock,$8.05,-0.04,-0.494%,442117858.00,United States,,90358,,,nyse
GUT.PRA,Gabelli Utility Trust (The),,,,,,,0,,,nyse
GUT.PRC,Gabelli Utility Trust (The),,,,,,,0,,,nyse
GVA,Granite Construction Incorporated Common Stock,$31.37,-0.69,-2.152%,1466274926.00,United States,,656094,Basic Industries,Military/Government/Technical,nyse
GWB,Great Western Bancorp Inc. Common Stock,$22.85,-1.00,-4.193%,1259143743.00,United States,2014,517892,Finance,Major Banks,nyse
GWRE,Guidewire Software Inc. Common Stock,$117.55,-4.11,-3.378%,9845303741.00,United States,2012,1009355,Technology,Computer Software: Prepackaged Software,nyse
GWW,W.W. Grainger Inc. Common Stock,$370.46,-6.23,-1.654%,19881865803.00,United States,,636444,Consumer Services,Office Equipment/Supplies/Services,nyse
GYC,Corporate Asset Backed Corp CABCO Corporate Asset Backed Corporation CABCO Series 2004-102 Trust (SBC Communications Inc.) Collared Floating Rate Cllable Certificates,$25.1487,0.00,0.00%,0.00,United States,,55,Finance,Finance: Consumer Services,nyse
H,Hyatt Hotels Corporation Class A Common Stock,$65.95,-4.40,-6.254%,6672556475.00,United States,2009,1137364,Consumer Services,Hotels/Resorts,nyse
HAE,Haemonetics Corporation Common Stock,$114.05,-5.07,-4.256%,5791150837.00,United States,1991,621236,Health Care,Medical/Dental Instruments,nyse
HAL,Halliburton Company Common Stock,$17.28,-0.92,-5.055%,15275644537.00,United States,,16081662,Energy,Oilfield Services/Equipment,nyse
HASI,Hannon Armstrong Sustainable Infrastructure Capital Inc. Common Stock,$60.15,-5.36,-8.182%,4533922821.00,United States,2013,1097926,Consumer Services,Real Estate Investment Trusts,nyse
HBB,Hamilton Beach Brands Holding Company Class A Common Stock ,$18.49,-0.20,-1.07%,253054750.00,,2017,58132,Consumer Durables,Home Furnishings,nyse
HBI,Hanesbrands Inc. Common Stock,$16.04,0.42,2.689%,5587118436.00,United States,,7822669,Consumer Services,Clothing/Shoe/Accessory Stores,nyse
HBM,Hudbay Minerals Inc. Ordinary Shares (Canada),$5.58,-0.40,-6.689%,1457898603.00,Canada,,1546020,Basic Industries,Precious Metals,nyse
HCA,HCA Healthcare Inc. Common Stock,$157.02,-7.11,-4.332%,53131595394.00,United States,2011,2287629,Health Care,Hospital/Nursing Management,nyse
HCC,Warrior Met Coal Inc. Common Stock,$22.16,-0.63,-2.764%,1134286170.00,United States,2017,822990,Energy,Coal Mining,nyse
HCHC,HC2 Holdings Inc. Common Stock,$3.63,-0.38,-9.476%,278009260.00,United States,,877328,Capital Goods,Metal Fabrications,nyse
HCI,HCI Group Inc. Common Stock,$59.99,0.60,1.01%,478843599.00,United States,,107929,Finance,Property-Casualty Insurers,nyse
HCXY,Hercules Capital Inc. 6.25% Notes due 2033,$26.45,-0.2263,-0.848%,0.00,United States,2018,3162,,,nyse
HCXZ,Hercules Capital Inc. 5.25% Notes due 2025,$25.40,-0.01,-0.039%,0.00,United States,2018,1513,,,nyse
HD,Home Depot Inc. (The) Common Stock,$274.05,-8.55,-3.025%,295042444033.00,United States,,4335117,Consumer Services,RETAIL: Building Materials,nyse
HDB,HDFC Bank Limited Common Stock,$68.84,-3.96,-5.44%,126382367733.00,India,2001,2304805,Finance,Commercial Banks,nyse
HE,Hawaiian Electric Industries Inc. Common Stock,$33.94,0.18,0.533%,3705607349.00,United States,,466110,Public Utilities,Electric Utilities: Central,nyse
HEI,Heico Corporation Common Stock,$116.13,-6.00,-4.913%,15703312163.00,United States,,731495,Capital Goods,Aerospace,nyse
HEI/A,Heico Corporation,$105.07,-2.95,-2.731%,,United States,,210818,,,nyse
HEP,Holly Energy Partners L.P. Common Stock,$14.90,-0.15,-0.997%,1571058995.00,United States,2004,483053,Energy,Natural Gas Distribution,nyse
HEQ,John Hancock Hedged Equity & Income Fund Common Shares of Beneficial Interest,$11.30,-0.17,-1.482%,138129087.00,United States,2011,67649,,,nyse
HES,Hess Corporation Common Stock,$55.97,-1.22,-2.133%,17187123421.00,United States,,2621445,Energy,Integrated oil Companies,nyse
HESM,Hess Midstream LP Class A Share,$21.33,-0.58,-2.647%,384543810.00,United States,2017,110163,Energy,Oil & Gas Production,nyse
HEXO,HEXO Corp. Common Shares,$6.48,-0.14,-2.115%,791614212.00,,,5092247,Consumer Durables,Specialty Chemicals,nyse
HFC,HollyFrontier Corporation Common Stock,$30.87,0.90,3.003%,5001472785.00,United States,,3295340,Energy,Integrated oil Companies,nyse
HFRO,Highland Income Fund,$10.12,-0.09,-0.881%,722661924.00,,2017,262547,,,nyse
HFRO.PRA,Highland Income Fund,,,,,,,0,,,nyse
HGH,Hartford Financial Services Group Inc. (The) 7.875% Fixed to Floating Rate Junior Subordinated Debentures due 2042,$27.36,0.02,0.073%,0.00,United States,,32281,Finance,Property-Casualty Insurers,nyse
HGLB,Highland Global Allocation Fund Common Stock,$6.65,-0.09,-1.335%,144574671.00,,2019,77857,,,nyse
HGV,Hilton Grand Vacations Inc. Common Stock ,$29.90,-2.40,-7.43%,2544683842.00,,2016,1189779,Consumer Services,Hotels/Resorts,nyse
