Symbol,Name,Last Sale,Net Change,% Change,Market Cap,Country,IPO Year,Volume,Sector,Industry,Exchange
SVOKU,Seven Oaks Acquisition Corp. Unit,$10.52,-0.12,-1.128%,272205000.00,United States,2020,317216,Finance,Business Services,nasdaq
SVRA,Savara Inc. Common Stock,$1.64,-0.09,-5.202%,88791691.00,United States,,443243,Health Care,Major Pharmaceuticals,nasdaq
SVSVU,Spring Valley Acquisition Corp. Unit,$11.29,-0.51,-4.322%,0.00,United States,2020,136334,Finance,Business Services,nasdaq
SVSVW,Spring Valley Acquisition Corp. Warrant,$1.84,-0.22,-10.68%,0.00,United States,2020,304714,Finance,Business Services,nasdaq
SVVC,Firsthand Technology Value Fund Inc. Common Stock,$5.89,-0.17,-2.805%,40600100.00,United States,,82117,,,nasdaq
SWAV,ShockWave Medical Inc. Common Stock,$120.57,-0.85,-0.70%,4130702157.00,United States,2019,764196,Health Care,Medical/Dental Instruments,nasdaq
SWBI,Smith & Wesson Brands Inc. Common Stock,$16.38,-0.81,-4.712%,916974464.00,United States,,2697434,Capital Goods,Ordnance And Accessories,nasdaq
SWETU,Athlon Acquisition Corp. Unit,$10.21,-0.16,-1.543%,0.00,United States,2021,1198225,Finance,Business Services,nasdaq
SWIR,Sierra Wireless Inc. Common Stock,$20.00,0.50,2.564%,729114840.00,Canada,,711790,Technology,Radio And Television Broadcasting And Communications Equipment,nasdaq
SWKH,SWK Holdings Corporation Common Stock,$13.87,-0.63,-4.345%,177390268.00,United States,,10267,Finance,Diversified Financial Services,nasdaq
SWKS,Skyworks Solutions Inc. Common Stock,$155.85,-7.28,-4.463%,25883836062.00,United States,,2705560,Technology,Semiconductors,nasdaq
SWTX,SpringWorks Therapeutics Inc. Common Stock,$80.68,-3.25,-3.872%,3934534065.00,United States,2019,343455,Health Care,Biotechnology: Biological Products (No Diagnostic Substances),nasdaq
SXTC,China SXT Pharmaceuticals Inc. Ordinary Shares,$0.6141,-0.0859,-12.271%,36930064.00,China,2019,5474945,Health Care,Major Pharmaceuticals,nasdaq
SY,So-Young International Inc. American Depository Shares,$12.54,-0.18,-1.415%,1338893330.00,China,2019,747777,Technology,EDP Services,nasdaq
SYBT,Stock Yards Bancorp Inc. Common Stock,$42.50,-0.22,-0.515%,964411870.00,United States,,103950,Finance,Major Banks,nasdaq
SYBX,Synlogic Inc. Common Stock,$3.78,-0.25,-6.203%,131670948.00,United States,2015,593593,Health Care,Major Pharmaceuticals,nasdaq
SYKE,Sykes Enterprises Incorporated Common Stock,$40.39,-0.58,-1.416%,1598050989.00,United States,1996,229908,Technology,EDP Services,nasdaq
SYNA,Synaptics Incorporated Common Stock $0.001 Par Value,$102.52,-2.35,-2.241%,3538810170.00,United States,2002,483329,Technology,Semiconductors,nasdaq
SYNC,Synacor Inc. Common Stock,$1.704,-0.096,-5.333%,67553995.00,United States,2012,571762,Technology,Computer Software: Programming Data Processing,nasdaq
SYNH,Syneos Health Inc. Class A Common Stock,$72.91,-2.53,-3.354%,7576808148.00,United States,2014,932636,Health Care,Biotechnology: Commercial Physical & Biological Resarch,nasdaq
SYNL,Synalloy Corporation Common Stock,$8.46,-0.16,-1.856%,77059526.00,United States,,44680,Basic Industries,Steel/Iron Ore,nasdaq
SYPR,Sypris Solutions Inc. Common Stock,$2.46,0.07,2.929%,52439210.00,United States,,1542306,Capital Goods,Industrial Machinery/Components,nasdaq
SYRS,Syros Pharmaceuticals Inc. Common Stock,$10.44,-0.89,-7.855%,586697766.00,United States,2016,797715,Health Care,Major Pharmaceuticals,nasdaq
SYTA,Siyata Mobile Inc. Common Shares,$10.34,-0.17,-1.618%,47333128.00,Canada,2020,40251,Public Utilities,Telecommunications Equipment,nasdaq
SYTAW,Siyata Mobile Inc. Warrant,$5.07,-0.29,-5.41%,0.00,Canada,2020,7216,Public Utilities,Telecommunications Equipment,nasdaq
TA,TravelCenters of America Inc. Common Stock,$28.30,-1.59,-5.32%,407451995.00,United States,,305222,Consumer Durables,Automotive Aftermarket,nasdaq
TACO,Del Taco Restaurants Inc. Common Stock,$9.64,-0.28,-2.823%,359809077.00,United States,2014,279558,Consumer Services,Restaurants,nasdaq
TACT,TransAct Technologies Incorporated Common Stock,$9.71,-0.17,-1.721%,86699473.00,United States,1996,33258,Technology,Computer peripheral equipment,nasdaq
TAIT,Taitron Components Incorporated Class A Common Stock,$3.585,-0.065,-1.781%,20812169.00,United States,1995,25321,Technology,Electronic Components,nasdaq
TANH,Tantech Holdings Ltd. Common Stock,$1.79,-0.16,-8.205%,51711013.00,China,2015,4782471,Basic Industries,Major Chemicals,nasdaq
TANNI,TravelCenters of America Inc. 8.25% Senior Notes due 2028,$25.90,-0.075,-0.289%,0.00,United States,,4579,Consumer Durables,Automotive Aftermarket,nasdaq
TANNL,TravelCenters of America Inc. 8.00% Senior Notes due 2029,$25.54,-0.16,-0.623%,0.00,United States,,5727,Consumer Durables,Automotive Aftermarket,nasdaq
TANNZ,TravelCenters of America Inc. 8.00% Senior Notes due 2030,$25.35,-0.10,-0.393%,0.00,United States,,2691,Consumer Durables,Automotive Aftermarket,nasdaq
TAOP,Taoping Inc. Ordinary Shares ,$3.12,-0.13,-4.00%,23884240.00,China,,94367,Technology,Computer Software: Prepackaged Software,nasdaq
TARA,Protara Therapeutics Inc.  Common Stock,$19.57,-0.70,-3.453%,114648614.00,United States,2014,88582,Health Care,Biotechnology: Biological Products (No Diagnostic Substances),nasdaq
TARS,Tarsus Pharmaceuticals Inc. Common Stock,$37.69,-1.69,-4.292%,765876856.00,United States,2020,28095,Health Care,Biotechnology: Biological Products (No Diagnostic Substances),nasdaq
TAST,Carrols Restaurant Group Inc. Common Stock,$6.36,-0.15,-2.304%,331302156.00,United States,2006,392325,Consumer Services,Restaurants,nasdaq
TATT,TAT Technologies Ltd. Ordinary Shares,$5.60,-0.28,-4.762%,49698298.00,Israel,,38015,Capital Goods,Aerospace,nasdaq
TAYD,Taylor Devices Inc. Common Stock,$10.425,-0.045,-0.43%,36363693.00,United States,,6775,Capital Goods,Industrial Machinery/Components,nasdaq
TBBK,The Bancorp Inc Common Stock,$16.59,-0.32,-1.892%,955432600.00,United States,,434685,Finance,Major Banks,nasdaq
TBIO,Translate Bio Inc. Common Stock,$22.54,-0.60,-2.593%,1675213981.00,United States,2018,908829,Health Care,Biotechnology: Biological Products (No Diagnostic Substances),nasdaq
TBK,Triumph Bancorp Inc. Common Stock,$61.23,-1.83,-2.902%,1522680988.00,United States,2014,270443,Finance,Major Banks,nasdaq
TBKCP,Triumph Bancorp Inc. Depositary Shares Each Representing a 1/40th Interest in a Share of 7.125% Series C Fixed-Rate Non-Cumulative Perpetual Preferred Stock,$27.25,0.03,0.11%,0.00,United States,,12356,Finance,Major Banks,nasdaq
TBLT,ToughBuilt Industries Inc. Common Stock,$1.40,0.09,6.87%,73273106.00,United States,2018,10588350,Capital Goods,Industrial Machinery/Components,nasdaq
TBLTW,ToughBuilt Industries Inc. Warrant,$0.8202,0.0502,6.519%,0.00,United States,2018,225817,Capital Goods,Industrial Machinery/Components,nasdaq
TBNK,Territorial Bancorp Inc. Common Stock,$25.75,-0.31,-1.19%,244982075.00,United States,2009,46804,Finance,Savings Institutions,nasdaq
TBPH,Theravance Biopharma Inc. Ordinary Shares,$19.09,0.57,3.078%,1221403342.00,Cayman Islands,,475994,Health Care,Major Pharmaceuticals,nasdaq
TC,TuanChe Limited American Depositary Shares,$3.80,-0.07,-1.809%,76435168.00,China,2018,27487,Miscellaneous,Business Services,nasdaq
TCBI,Texas Capital Bancshares Inc. Common Stock,$61.51,-2.01,-3.164%,3104437380.00,United States,2003,545423,Finance,Major Banks,nasdaq
TCBIL,Texas Capital Bancshares Inc. 6.50% Subordinated Notes due 2042,$25.39,-0.02,-0.079%,0.00,United States,,6697,Finance,Major Banks,nasdaq
TCBIP,Texas Capital Bancshares Inc. Non Cumulative Preferred Perpetual Stock Series A,$25.40,-0.0307,-0.121%,0.00,United States,,13404,Finance,Major Banks,nasdaq
TCBK,TriCo Bancshares Common Stock,$38.08,-0.86,-2.209%,1133618333.00,United States,,109044,Finance,Major Banks,nasdaq
TCDA,Tricida Inc. Common Stock,$6.87,-0.05,-0.723%,344767515.00,United States,2018,716618,Health Care,Major Pharmaceuticals,nasdaq
TCF,TCF Financial Corporation Common Stock,$39.29,-0.85,-2.118%,5992256594.00,United States,,1248010,Finance,Major Banks,nasdaq
TCFC,The Community Financial Corporation Common Stock,$24.85,-1.60,-6.049%,146952364.00,United States,,17271,Finance,Major Banks,nasdaq
TCFCP,TCF Financial Corporation Depositary Shares representing 5.70% Series C Non-Cumulative Preferred Stock,$25.94,-0.2999,-1.143%,0.00,United States,,17075,Finance,Major Banks,nasdaq
TCMD,Tactile Systems Technology Inc. Common Stock,$57.00,2.02,3.674%,1107206703.00,United States,2016,271696,Health Care,Medical/Dental Instruments,nasdaq
TCOM,Trip.com Group Limited American Depositary Shares,$31.83,-0.14,-0.438%,18877409952.00,China,,10115759,Miscellaneous,Business Services,nasdaq
TCON,TRACON Pharmaceuticals Inc. Common Stock,$8.64,-1.79,-17.162%,125532012.00,United States,2015,1578427,Health Care,Biotechnology: Biological Products (No Diagnostic Substances),nasdaq
TCPC,BlackRock TCP Capital Corp. Common Stock,$11.75,-0.21,-1.756%,678765352.00,United States,2012,210110,,,nasdaq
TCRR,TCR2 Therapeutics Inc. Common Stock,$25.90,-1.31,-4.814%,984518389.00,United States,2019,891951,Health Care,Biotechnology: Biological Products (No Diagnostic Substances),nasdaq
TCX,Tucows Inc. Class A Common Stock,$92.26,13.72,17.469%,978534193.00,Canada,,138366,Technology,EDP Services,nasdaq
TDAC,Trident Acquisitions Corp. Common Stock,$11.48,-0.43,-3.61%,137389426.00,United States,2018,458707,Finance,Business Services,nasdaq
TDACU,Trident Acquisitions Corp. Units,$15.01,0.00,0.00%,0.00,United States,2018,101,Finance,Business Services,nasdaq
TDACW,Trident Acquisitions Corp. Warrants,$1.8099,-0.3001,-14.223%,0.00,United States,2018,945366,Finance,Business Services,nasdaq
TEAM,Atlassian Corporation Plc Class A Ordinary Shares,$217.30,-6.58,-2.939%,54151588950.00,United Kingdom,2015,2232903,Technology,Computer Software: Prepackaged Software,nasdaq
TECH,Bio-Techne Corp Common Stock,$318.43,-21.91,-6.438%,12294361628.00,United States,,194366,Health Care,Biotechnology: Biological Products (No Diagnostic Substances),nasdaq
TECTP,Tectonic Financial Inc. 9.00% Fixed-to-Floating Rate Series B Non-Cumulative Perpetual Preferred Stock,$9.65,-0.10,-1.026%,0.00,United States,2019,201,Finance,Major Banks,nasdaq
TEDU,Tarena International Inc. American Depositary Shares,$3.11,-0.08,-2.508%,168547924.00,China,2014,229604,Consumer Services,Other Consumer Services,nasdaq
TEKK,Tekkorp Digital Acquisition Corp. Class A Ordinary Shares,$10.26,0.14,1.383%,330243750.00,United States,2020,325218,Finance,Business Services,nasdaq
TEKKU,Tekkorp Digital Acquisition Corp. Unit,$10.55,-0.16,-1.494%,0.00,United States,2020,258654,Finance,Business Services,nasdaq
TEKKW,Tekkorp Digital Acquisition Corp. Warrant,$1.64,-0.11,-6.286%,0.00,United States,2020,269111,Finance,Business Services,nasdaq
TELA,TELA Bio Inc. Common Stock,$13.79,-0.51,-3.566%,199021210.00,United States,2019,18473,Health Care,Medical/Dental Instruments,nasdaq
TELL,Tellurian Inc. Common Stock,$2.96,-0.56,-15.909%,978174523.00,United States,,30138659,Energy,Oil & Gas Production,nasdaq
TENB,Tenable Holdings Inc. Common Stock,$48.44,-0.05,-0.103%,4994908571.00,United States,2018,1423294,Technology,Computer Software: Prepackaged Software,nasdaq
TENX,Tenax Therapeutics Inc. Common Stock,$2.68,0.02,0.752%,33819909.00,United States,,12416439,Health Care,Major Pharmaceuticals,nasdaq
TER,Teradyne Inc. Common Stock,$130.11,-7.99,-5.786%,21605523651.00,United States,,2349365,Capital Goods,Electrical Products,nasdaq
TESS,TESSCO Technologies Incorporated Common Stock,$7.75,0.68,9.618%,67894356.00,United States,1994,108002,Technology,Electronic Components,nasdaq
TFFP,TFF Pharmaceuticals Inc. Common Stock,$16.31,-0.04,-0.245%,362510692.00,United States,2019,564708,Health Care,Major Pharmaceuticals,nasdaq
TFSL,TFS Financial Corporation Common Stock,$18.19,-0.76,-4.011%,5103461270.00,United States,,194208,Finance,Savings Institutions,nasdaq
TGA,TransGlobe Energy Corporation Ordinary Shares (Canada),$1.03,-0.02,-1.905%,74718333.00,Canada,,437985,Energy,Oil & Gas Production,nasdaq
TGLS,Tecnoglass Inc. Ordinary Shares,$7.02,-0.17,-2.364%,334676906.00,Colombia,2012,51621,Consumer Durables,Electronic Components,nasdaq
TGTX,TG Therapeutics Inc. Common Stock,$46.41,-3.595,-7.189%,6395771150.00,United States,,1642519,Health Care,Major Pharmaceuticals,nasdaq
TH,Target Hospitality Corp. Common Stock,$1.64,0.07,4.459%,165920301.00,United States,2018,326816,Consumer Services,Hotels/Resorts,nasdaq
THBR,Thunder Bridge Acquisition II Ltd. Class A Ordinary Shares,$10.96,-1.00,-8.361%,472650000.00,United States,2019,3819821,Finance,Business Services,nasdaq
THBRU,Thunder Bridge Acquisition II Ltd. Units,$16.25,0.00,0.00%,0.00,United States,2019,50,Finance,Business Services,nasdaq
THBRW,Thunder Bridge Acquisition II Ltd. Warrants,$2.71,-0.39,-12.581%,0.00,United States,2019,770837,Finance,Business Services,nasdaq
THCA,Tuscan Holdings Corp. II Common Stock,$10.775,-0.185,-1.688%,236915313.00,United States,2019,898271,Finance,Business Services,nasdaq
THCAU,Tuscan Holdings Corp. II Unit,$13.32,0.00,0.00%,0.00,United States,2019,0,Finance,Business Services,nasdaq
THCAW,Tuscan Holdings Corp. II Warrant,$1.70,-0.30,-15.00%,0.00,United States,2019,165495,Finance,Business Services,nasdaq
THCB,Tuscan Holdings Corp. Common Stock,$15.69,1.34,9.338%,556740853.00,United States,2019,4410615,Finance,Business Services,nasdaq
THCBU,Tuscan Holdings Corp. Unit,$19.8001,1.3001,7.028%,0.00,United States,2019,2897,Finance,Business Services,nasdaq
THCBW,Tuscan Holdings Corp. Warrant,$4.12,0.35,9.284%,0.00,United States,2019,1942557,Finance,Business Services,nasdaq
THFF,First Financial Corporation Indiana Common Stock,$38.40,-1.28,-3.226%,526637722.00,United States,,45242,Finance,Major Banks,nasdaq
THMO,ThermoGenesis Holdings Inc. Common Stock,$2.69,-0.35,-11.513%,20971697.00,United States,,2105236,Capital Goods,Medical Specialities,nasdaq
THRM,Gentherm Inc Common Stock,$63.82,-2.14,-3.244%,2086293670.00,United States,,212275,Capital Goods,Auto Parts:O.E.M.,nasdaq
THRY,Thryv Holdings Inc. Common Stock,$18.97,-0.53,-2.718%,589337936.00,United States,,34399,Consumer Services,Advertising,nasdaq
THTX,Theratechnologies Inc. Common Shares,$2.21,-0.02,-0.897%,170199638.00,Canada,,421315,Health Care,Major Pharmaceuticals,nasdaq
THWWW,Target Hospitality Corp. Warrant expiring 3/15/2024,$0.1113,0.0059,5.598%,0.00,United States,2018,224449,Consumer Services,Hotels/Resorts,nasdaq
TIG,Trean Insurance Group Inc. Common Stock,$15.25,-0.37,-2.369%,780018926.00,United States,2020,98840,Finance,Property-Casualty Insurers,nasdaq
TIGO,Millicom International Cellular S.A. Common Stock,$37.06,-0.51,-1.357%,3750956819.00,Luxembourg,,94697,Public Utilities,Telecommunications Equipment,nasdaq
TIGR,UP Fintech Holding Ltd American Depositary Share representing fifteen Class A Ordinary Shares,$16.36,-0.86,-4.994%,2306067269.00,China,2019,6444996,Finance,Investment Bankers/Brokers/Service,nasdaq
TILE,Interface Inc. Common Stock,$10.84,-0.10,-0.914%,635976621.00,United States,,511690,Consumer Durables,Home Furnishings,nasdaq
TIPT,Tiptree Inc. Common Stock,$4.86,-0.15,-2.994%,163465789.00,United States,,123356,Finance,Property-Casualty Insurers,nasdaq
TIRX,TIAN RUIXIANG Holdings Ltd Class A Ordinary Shares,$25.50,21.50,537.50%,204000000.00,China,,500769,,,nasdaq
TITN,Titan Machinery Inc. Common Stock,$20.73,-1.43,-6.453%,467582397.00,United States,2007,281157,Consumer Services,Other Specialty Stores,nasdaq
TLC,Taiwan Liposome Company Ltd. American Depository Shares,$4.765,-0.085,-1.753%,200499130.00,Taiwan,2018,25831,Health Care,Major Pharmaceuticals,nasdaq
TLGT,Teligent Inc. Common Stock,$0.90,-0.24,-21.053%,19578801.00,United States,,5099476,Health Care,Major Pharmaceuticals,nasdaq
TLMD,SOC Telemed Inc. Class A Common Stock,$7.43,0.06,0.814%,570429795.00,United States,2020,360919,Health Care,Misc Health and Biotechnology Services,nasdaq
TLMDW,SOC Telemed Inc. Warrants,$1.27,0.0588,4.855%,0.00,United States,2020,20697,Health Care,Misc Health and Biotechnology Services,nasdaq
TLND,Talend S.A. American Depositary Shares,$43.06,-1.32,-2.974%,1367729334.00,France,2016,239814,Technology,Computer Software: Prepackaged Software,nasdaq
TLRY,Tilray Inc. Class 2 Common Stock ,$18.55,-0.48,-2.522%,2935662954.00,Canada,2018,37420369,Consumer Durables,Specialty Chemicals,nasdaq
TLS,Telos Corporation Common Stock,$35.81,-2.70,-7.011%,0.00,United States,2020,642896,Technology,EDP Services,nasdaq
TLSA,Tiziana Life Sciences plc American Depository Share,$3.39,-0.57,-14.394%,329867828.00,United Kingdom,2018,1448342,Health Care,Major Pharmaceuticals,nasdaq
TMDI,Titan Medical Inc. Ordinary Shares,$2.77,-0.37,-11.783%,227652015.00,Canada,,7067826,Health Care,Medical/Dental Instruments,nasdaq
TMDX,TransMedics Group Inc. Common Stock,$22.90,-0.74,-3.13%,621982664.00,United States,2019,157562,Health Care,Biotechnology: Electromedical & Electrotherapeutic Apparatus,nasdaq
TMKRU,Tastemaker Acquisition Corp. Unit,$10.31,-0.09,-0.865%,0.00,United States,2021,315853,Finance,Business Services,nasdaq
TMPM,Turmeric Acquisition Corp. Class A Ordinary Shares,$10.09,-0.13,-1.272%,127479583.00,United States,2020,10233,Finance,Business Services,nasdaq
TMPMU,Turmeric Acquisition Corp. Unit,$10.70,-0.15,-1.382%,0.00,United States,2020,8072,Finance,Business Services,nasdaq
TMPMW,Turmeric Acquisition Corp. Warrant,$1.65,0.00,0.00%,0.00,United States,2020,873,Finance,Business Services,nasdaq
TMTS,Spartacus Acquisition Corporation Class A Common Stock,$10.17,-0.10,-0.974%,254250000.00,United States,2020,84657,Finance,Business Services,nasdaq
TMTSU,Spartacus Acquisition Corporation Unit,$10.66,-0.35,-3.179%,0.00,United States,2020,9163,Finance,Business Services,nasdaq
TMTSW,Spartacus Acquisition Corporation Warrant,$1.02,-0.3798,-27.132%,0.00,United States,2020,77864,Finance,Business Services,nasdaq
TMUS,T-Mobile US Inc. Common Stock,$123.27,-8.14,-6.194%,153001093878.00,United States,,7020644,Public Utilities,Telecommunications Equipment,nasdaq
TNAV,Telenav Inc. Common Stock,$4.77,-0.01,-0.209%,228957648.00,United States,2010,321713,Capital Goods,Industrial Machinery/Components,nasdaq
TNDM,Tandem Diabetes Care Inc. Common Stock,$92.86,-4.89,-5.003%,5775391392.00,United States,2013,686840,Health Care,Medical/Dental Instruments,nasdaq
TNXP,Tonix Pharmaceuticals Holding Corp. Common Stock,$0.951,-0.0396,-3.998%,251803165.00,United States,,45123826,Health Care,Major Pharmaceuticals,nasdaq
TOMZ,TOMI Environmental Solutions Inc. Common Stock,$4.79,-0.15,-3.036%,80285252.00,United States,,326102,Basic Industries,Major Chemicals,nasdaq
TOPS,TOP Ships Inc. Common Stock,$1.65,-0.29,-14.948%,65722754.00,Greece,,7519848,Transportation,Marine Transportation,nasdaq
TOUR,Tuniu Corporation American Depositary Shares,$2.08,0.01,0.483%,256604712.00,China,2014,1118623,Consumer Services,Transportation Services,nasdaq
TOWN,TowneBank Common Stock,$23.59,-1.24,-4.994%,1713927275.00,United States,,194537,,,nasdaq
TPCO,Tribune Publishing Company Common Stock,$15.04,-0.56,-3.59%,549454139.00,United States,,70395,Consumer Services,Newspapers/Magazines,nasdaq
TPIC,TPI Composites Inc. Common Stock,$60.38,-4.38,-6.763%,2158029262.00,United States,2016,1013651,Energy,Industrial Machinery/Components,nasdaq
TPTX,Turning Point Therapeutics Inc. Common Stock,$119.02,-9.05,-7.066%,5733484642.00,United States,2019,518990,Health Care,Major Pharmaceuticals,nasdaq
TRCH,Torchlight Energy Resources Inc. Common Stock,$1.57,-0.34,-17.801%,156436610.00,United States,,16070552,Energy,Oil & Gas Production,nasdaq
TREE,LendingTree Inc. Common Stock,$331.64,-4.21,-1.254%,4353492337.00,United States,,216639,Finance,Finance: Consumer Services,nasdaq
TRHC,Tabula Rasa HealthCare Inc. Common Stock,$62.72,3.37,5.678%,1494490780.00,United States,2016,1120696,Miscellaneous,Business Services,nasdaq
TRIB,Trinity Biotech plc American Depositary Shares,$4.21,-0.29,-6.444%,87995744.00,Ireland,1992,319824,Health Care,Biotechnology: In Vitro & In Vivo Diagnostic Substances,nasdaq
TRIL,Trillium Therapeutics Inc. Common Shares,$11.95,-0.47,-3.784%,1059778974.00,Canada,,2180197,Health Care,Major Pharmaceuticals,nasdaq
TRIN,Trinity Capital Inc.,,,,,United States,,0,,,nasdaq
TRIP,TripAdvisor Inc. Common Stock,$33.94,1.24,3.792%,4565793739.00,United States,,6233846,Technology,Computer Software: Programming Data Processing,nasdaq
TRIT,Triterras Inc. Class A Ordinary Shares,$8.14,-0.32,-3.783%,677214374.00,Singapore,,7948308,Technology,EDP Services,nasdaq
TRITW,Triterras Inc. Warrant,$1.97,-0.14,-6.635%,0.00,Singapore,,920139,Technology,EDP Services,nasdaq
TRMB,Trimble Inc. Common Stock,$66.65,-3.02,-4.335%,16674206339.00,United States,1990,1500213,Capital Goods,Industrial Machinery/Components,nasdaq
TRMD,TORM plc Class A Common Stock,$7.20,-0.20,-2.703%,535410432.00,United Kingdom,,31073,Transportation,Marine Transportation,nasdaq
TRMK,Trustmark Corporation Common Stock,$28.43,-1.76,-5.83%,1803139203.00,United States,,328087,Finance,Major Banks,nasdaq
TRMT,Tremont Mortgage Trust Common Shares of Beneficial Interest,$3.90,-0.12,-2.985%,32382691.00,United States,2017,53219,Consumer Services,Real Estate Investment Trusts,nasdaq
TRNS,Transcat Inc. Common Stock,$35.36,-0.65,-1.805%,262889083.00,United States,,21530,Capital Goods,Electrical Products,nasdaq
TROW,T. Rowe Price Group Inc. Common Stock,$156.50,-4.10,-2.553%,35436734296.00,United States,1986,1557952,Finance,Investment Bankers/Brokers/Service,nasdaq
TRS,TriMas Corporation Common Stock,$31.38,-1.37,-4.183%,1356404579.00,United States,2007,403199,Capital Goods,Industrial Specialties,nasdaq
TRST,TrustCo Bank Corp NY Common Stock,$6.28,-0.28,-4.268%,605597086.00,United States,,655832,Finance,Major Banks,nasdaq
TRUE,TrueCar Inc. Common Stock,$4.67,-0.27,-5.466%,486119512.00,United States,2014,889282,Technology,Computer Software: Programming Data Processing,nasdaq
TRUP,Trupanion Inc. Common Stock,$118.51,-0.58,-0.487%,4647363013.00,United States,,503794,Health Care,Medical Specialities,nasdaq
TRVG,trivago N.V. American Depositary Shares,$3.19,1.09,51.905%,1128210251.00,Germany,2016,43816490,Technology,EDP Services,nasdaq
TRVI,Trevi Therapeutics Inc. Common Stock,$2.93,-0.24,-7.571%,53855715.00,United States,2019,136660,Health Care,Major Pharmaceuticals,nasdaq
TRVN,Trevena Inc. Common Stock,$2.20,-0.11,-4.762%,345466026.00,United States,2014,3468946,Health Care,Major Pharmaceuticals,nasdaq
TSBK,Timberland Bancorp Inc. Common Stock,$25.85,-1.54,-5.622%,214968419.00,United States,,29413,Finance,Banks,nasdaq
TSC,TriState Capital Holdings Inc. Common Stock,$18.16,-0.86,-4.522%,592013893.00,United States,2013,127079,Finance,Major Banks,nasdaq
TSCAP,TriState Capital Holdings Inc. Dep Shs Rep 1/40th Int 6.75% Srs A Non-Cum Pfd Stock,$26.0101,-0.0999,-0.383%,762766236.00,United States,,184,Finance,Major Banks,nasdaq
TSCBP,TriState Capital Holdings Inc. Depositary Share representing a 1/40th Interest in a Share of 6.375% Fixed-to-Floating Rate Series B Non-Cumulative Perpetual Preferred Stock,$26.33,-0.15,-0.566%,0.00,United States,,376,Finance,Major Banks,nasdaq
TSCO,Tractor Supply Company Common Stock,$153.72,1.83,1.205%,17907979406.00,United States,1994,2174467,Consumer Services,RETAIL: Building Materials,nasdaq
TSEM,Tower Semiconductor Ltd. Ordinary Shares,$28.45,-1.35,-4.53%,3067949677.00,Israel,1994,629618,Technology,Semiconductors,nasdaq
TSHA,Taysha Gene Therapies Inc. Common Stock,$30.00,-0.70,-2.28%,1132843050.00,United States,2020,95076,Health Care,Biotechnology: Biological Products (No Diagnostic Substances),nasdaq
TSIA,TS Innovation Acquisitions Corp. Class A Common Stock,$12.56,-1.09,-7.985%,485130000.00,United States,2020,2988025,Finance,Business Services,nasdaq
TSIAU,TS Innovation Acquisitions Corp. Unit,$13.42,-1.51,-10.114%,0.00,United States,2020,129707,Finance,Business Services,nasdaq
TSIAW,TS Innovation Acquisitions Corp. Warrant,$3.36,-0.75,-18.248%,0.00,United States,2020,284047,Finance,Business Services,nasdaq
TSLA,Tesla Inc. Common Stock,$864.16,-18.93,-2.144%,819137897429.00,United States,2010,26741352,Capital Goods,Auto Manufacturing,nasdaq
TSRI,TSR Inc. Common Stock,$7.626,0.5048,7.089%,14962685.00,United States,,16502,Technology,EDP Services,nasdaq
TTCF,Tattooed Chef Inc Class A Common Stock,$24.28,-0.37,-1.501%,622791979.00,United States,2018,3083178,Consumer Non-Durables,Packaged Foods,nasdaq
TTCFW,Tattooed Chef Inc. Warrant,$12.40,-0.32,-2.516%,0.00,United States,2018,275673,Consumer Non-Durables,Packaged Foods,nasdaq
TTD,The Trade Desk Inc. Class A Common Stock,$756.30,-19.99,-2.575%,35519096309.00,United States,2016,704825,Technology,Computer Software: Programming Data Processing,nasdaq
TTEC,TTEC Holdings Inc. Common Stock,$76.91,-2.78,-3.489%,3594404078.00,United States,1996,202625,Technology,Professional Services,nasdaq
TTEK,Tetra Tech Inc. Common Stock,$128.97,-4.60,-3.444%,6989221943.00,United States,1991,467807,Consumer Services,Military/Government/Technical,nasdaq
TTGT,TechTarget Inc. Common Stock,$74.83,1.51,2.059%,2102626245.00,United States,2007,381259,Miscellaneous,Business Services,nasdaq
TTMI,TTM Technologies Inc. Common Stock,$13.72,-0.33,-2.349%,1464496618.00,United States,2000,1959692,Technology,Electrical Products,nasdaq
TTNP,Titan Pharmaceuticals Inc. Common Stock,$3.20,-0.23,-6.706%,21280000.00,United States,,1383040,Health Care,Biotechnology: Biological Products (No Diagnostic Substances),nasdaq
TTOO,T2 Biosystems Inc. Common Stock,$2.24,-0.57,-20.285%,331420389.00,United States,2014,37273330,Health Care,Medical/Dental Instruments,nasdaq
TTWO,Take-Two Interactive Software Inc. Common Stock,$195.38,-4.40,-2.202%,22490293984.00,United States,1997,1284864,Technology,Computer Software: Prepackaged Software,nasdaq
TURN,180 Degree Capital Corp. Common Stock,$6.3974,-0.2925,-4.372%,66365694.00,United States,,31958,Finance,Finance/Investors Services,nasdaq
TUSK,Mammoth Energy Services Inc. Common Stock,$4.26,0.00,0.00%,194961171.00,United States,2016,121428,Energy,Oilfield Services/Equipment,nasdaq
